<?xml version="1.0" encoding="UTF-8"?>
<!--
  ~ Copyright Mazaffaka Project (c) 2013.
  -->

<!DOCTYPE list SYSTEM "class_data.dtd">

<list>
    <class_data class_id="175">
        <lvl_up_data>
            <lvl_add lvl="1" cp="60.17874876" hp="100.2979146" mp="26.40264026"/>
            <lvl_add lvl="2" cp="69.39622642" hp="115.6603774" mp="36.20214395"/>
            <lvl_add lvl="3" cp="78.71499503" hp="131.1916584" mp="41.83767228"/>
            <lvl_add lvl="4" cp="88.13505462" hp="146.8917577" mp="47.53445636"/>
            <lvl_add lvl="5" cp="97.65640516" hp="162.7606753" mp="53.29249617"/>
            <lvl_add lvl="6" cp="107.2790467" hp="178.7984111" mp="59.11179173"/>
            <lvl_add lvl="7" cp="117.0029791" hp="195.0049652" mp="64.99234303"/>
            <lvl_add lvl="8" cp="126.8282026" hp="211.3803376" mp="70.93415008"/>
            <lvl_add lvl="9" cp="136.754717" hp="227.9245283" mp="76.93721286"/>
            <lvl_add lvl="10" cp="146.7825223" hp="244.6375372" mp="83.00153139"/>
            <lvl_add lvl="11" cp="156.9116187" hp="261.5193644" mp="89.12710567"/>
            <lvl_add lvl="12" cp="167.142006" hp="278.5700099" mp="95.31393568"/>
            <lvl_add lvl="13" cp="177.4736842" hp="295.7894737" mp="101.5620214"/>
            <lvl_add lvl="14" cp="187.9066534" hp="313.1777557" mp="107.8713629"/>
            <lvl_add lvl="15" cp="198.4409136" hp="330.734856" mp="114.2419602"/>
            <lvl_add lvl="16" cp="209.0764647" hp="348.4607746" mp="120.6738132"/>
            <lvl_add lvl="17" cp="219.8133069" hp="366.3555114" mp="127.1669219"/>
            <lvl_add lvl="18" cp="230.6514399" hp="384.4190665" mp="133.7212864"/>
            <lvl_add lvl="19" cp="241.590864" hp="402.6514399" mp="140.3369066"/>
            <lvl_add lvl="20" cp="252.6315789" hp="421.0526316" mp="147.0137825"/>
            <lvl_add lvl="21" cp="269.0168818" hp="448.3614697" mp="157.1209801"/>
            <lvl_add lvl="22" cp="285.551142" hp="475.91857" mp="167.3200613"/>
            <lvl_add lvl="23" cp="302.2343595" hp="503.7239325" mp="177.611026"/>
            <lvl_add lvl="24" cp="319.0665343" hp="531.7775571" mp="187.9938744"/>
            <lvl_add lvl="25" cp="336.0476663" hp="560.0794439" mp="198.4686064"/>
            <lvl_add lvl="26" cp="353.1777557" hp="588.6295929" mp="209.0352221"/>
            <lvl_add lvl="27" cp="370.4568024" hp="617.428004" mp="219.6937213"/>
            <lvl_add lvl="28" cp="387.8848064" hp="646.4746773" mp="230.4441041"/>
            <lvl_add lvl="29" cp="405.4617676" hp="675.7696127" mp="241.2863706"/>
            <lvl_add lvl="30" cp="423.1876862" hp="705.3128103" mp="252.2205207"/>
            <lvl_add lvl="31" cp="441.0625621" hp="735.1042701" mp="263.2465544"/>
            <lvl_add lvl="32" cp="459.0863952" hp="765.1439921" mp="274.3644717"/>
            <lvl_add lvl="33" cp="477.2591857" hp="795.4319762" mp="285.5742726"/>
            <lvl_add lvl="34" cp="495.5809335" hp="825.9682224" mp="296.8759571"/>
            <lvl_add lvl="35" cp="514.0516385" hp="856.7527309" mp="308.2695253"/>
            <lvl_add lvl="36" cp="532.6713009" hp="887.7855015" mp="319.754977"/>
            <lvl_add lvl="37" cp="551.4399206" hp="919.0665343" mp="331.3323124"/>
            <lvl_add lvl="38" cp="570.3574975" hp="950.5958292" mp="343.0015314"/>
            <lvl_add lvl="39" cp="589.4240318" hp="982.3733863" mp="354.762634"/>
            <lvl_add lvl="40" cp="608.6395233" hp="1014.399206" mp="366.6156202"/>
            <lvl_add lvl="41" cp="638.0734856" hp="1063.455809" mp="386.5237366"/>
            <lvl_add lvl="42" cp="667.733863" hp="1112.889772" mp="406.5849923"/>
            <lvl_add lvl="43" cp="697.6206554" hp="1162.701092" mp="426.7993874"/>
            <lvl_add lvl="44" cp="727.733863" hp="1212.889772" mp="447.1669219"/>
            <lvl_add lvl="45" cp="758.0734856" hp="1263.455809" mp="467.6875957"/>
            <lvl_add lvl="46" cp="788.6395233" hp="1314.399206" mp="488.3614089"/>
            <lvl_add lvl="47" cp="819.4319762" hp="1365.71996" mp="509.1883614"/>
            <lvl_add lvl="48" cp="850.4508441" hp="1417.418073" mp="530.1684533"/>
            <lvl_add lvl="49" cp="881.6961271" hp="1469.493545" mp="551.3016845"/>
            <lvl_add lvl="50" cp="913.1678252" hp="1521.946375" mp="572.5880551"/>
            <lvl_add lvl="51" cp="944.8659384" hp="1574.776564" mp="594.0275651"/>
            <lvl_add lvl="52" cp="976.7904667" hp="1627.984111" mp="615.6202144"/>
            <lvl_add lvl="53" cp="1008.94141" hp="1681.569017" mp="637.3660031"/>
            <lvl_add lvl="54" cp="1041.318769" hp="1735.531281" mp="659.2649311"/>
            <lvl_add lvl="55" cp="1073.922542" hp="1789.870904" mp="681.3169985"/>
            <lvl_add lvl="56" cp="1106.752731" hp="1844.587885" mp="703.5222052"/>
            <lvl_add lvl="57" cp="1139.809335" hp="1899.682224" mp="725.8805513"/>
            <lvl_add lvl="58" cp="1173.092354" hp="1955.153923" mp="748.3920368"/>
            <lvl_add lvl="59" cp="1206.601787" hp="2011.002979" mp="771.0566616"/>
            <lvl_add lvl="60" cp="1240.337637" hp="2067.229394" mp="793.8744257"/>
            <lvl_add lvl="61" cp="1274.299901" hp="2123.833168" mp="816.8453292"/>
            <lvl_add lvl="62" cp="1308.48858" hp="2180.8143" mp="839.9693721"/>
            <lvl_add lvl="63" cp="1342.903674" hp="2238.17279" mp="863.2465544"/>
            <lvl_add lvl="64" cp="1377.545184" hp="2295.90864" mp="886.676876"/>
            <lvl_add lvl="65" cp="1412.413108" hp="2354.021847" mp="910.2603369"/>
            <lvl_add lvl="66" cp="1447.507448" hp="2412.512413" mp="933.9969372"/>
            <lvl_add lvl="67" cp="1482.828203" hp="2471.380338" mp="957.8866769"/>
            <lvl_add lvl="68" cp="1518.375372" hp="2530.625621" mp="981.9295559"/>
            <lvl_add lvl="69" cp="1554.148957" hp="2590.248262" mp="1006.125574"/>
            <lvl_add lvl="70" cp="1590.148957" hp="2650.248262" mp="1030.474732"/>
            <lvl_add lvl="71" cp="1626.375372" hp="2710.625621" mp="1054.977029"/>
            <lvl_add lvl="72" cp="1662.828203" hp="2771.380338" mp="1079.632466"/>
            <lvl_add lvl="73" cp="1699.507448" hp="2832.512413" mp="1104.441041"/>
            <lvl_add lvl="74" cp="1736.413108" hp="2894.021847" mp="1129.402757"/>
            <lvl_add lvl="75" cp="1773.545184" hp="2955.90864" mp="1154.517611"/>
            <lvl_add lvl="76" cp="1810.903674" hp="3018.17279" mp="1179.785605"/>
            <lvl_add lvl="77" cp="1848.48858" hp="3080.8143" mp="1205.206738"/>
            <lvl_add lvl="78" cp="1886.299901" hp="3143.833168" mp="1230.781011"/>
            <lvl_add lvl="79" cp="1924.337637" hp="3207.229394" mp="1256.508423"/>
            <lvl_add lvl="80" cp="1962.601787" hp="3271.002979" mp="1282.388974"/>
            <lvl_add lvl="81" cp="2001.092354" hp="3335.153923" mp="1308.422665"/>
            <lvl_add lvl="82" cp="2039.809335" hp="3399.682224" mp="1334.609495"/>
            <lvl_add lvl="83" cp="2078.752731" hp="3464.587885" mp="1360.949464"/>
            <lvl_add lvl="84" cp="2117.922542" hp="3529.870904" mp="1387.442573"/>
            <lvl_add lvl="85" cp="9849.473684" hp="6486.888977" mp="2770.163859"/>
            <lvl_add lvl="86" cp="9946.700099" hp="6550.652433" mp="2822.767228"/>
            <lvl_add lvl="87" cp="10043.15293" hp="6614.393247" mp="2875.75804"/>
            <lvl_add lvl="88" cp="10141.83217" hp="6679.51142" mp="2928.667688"/>
            <lvl_add lvl="89" cp="10241.74479" hp="6745.006951" mp="2982.964778"/>
            <lvl_add lvl="90" cp="10341.88381" hp="6811.893744" mp="3035.180704"/>
            <lvl_add lvl="91" cp="10443.24926" hp="6877.150943" mp="3089.784074"/>
            <lvl_add lvl="92" cp="10545.84111" hp="6945.792453" mp="3144.774885"/>
            <lvl_add lvl="93" cp="10648.66634" hp="7013.811321" mp="3198.684533"/>
            <lvl_add lvl="94" cp="10753.71102" hp="7082.207547" mp="3253.981623"/>
            <lvl_add lvl="95" cp="10858.98908" hp="7151.988083" mp="3308.19755"/>
            <lvl_add lvl="96" cp="10965.49355" hp="7221.893744" mp="3364.800919"/>
            <lvl_add lvl="97" cp="11072.23138" hp="7292.169811" mp="3420.79173"/>
            <lvl_add lvl="98" cp="11181.18868" hp="7364.830189" mp="3476.701378"/>
            <lvl_add lvl="99" cp="11290.37934" hp="7476.87488" mp="3532.998469"/>
        </lvl_up_data>
    </class_data>
</list>
