<?xml version="1.0" encoding="UTF-8"?>
<!--
  ~ Copyright Mazaffaka Project (c) 2013.
  -->

<!DOCTYPE list SYSTEM "class_data.dtd">

<list>
    <class_data class_id="146">
        <lvl_up_data>
            <lvl_add lvl="1" hp="101.0" mp="40.0" cp="90.9"/>
            <lvl_add lvl="2" hp="116.47" mp="47.28" cp="104.823"/>
            <lvl_add lvl="3" hp="132.11" mp="54.64" cp="118.899"/>
            <lvl_add lvl="4" hp="147.92" mp="62.08" cp="133.128"/>
            <lvl_add lvl="5" hp="163.9" mp="69.6" cp="147.51"/>
            <lvl_add lvl="6" hp="180.05" mp="77.2" cp="162.045"/>
            <lvl_add lvl="7" hp="196.37" mp="84.88" cp="176.733"/>
            <lvl_add lvl="8" hp="212.86" mp="92.64" cp="191.574"/>
            <lvl_add lvl="9" hp="229.52" mp="100.48" cp="206.568"/>
            <lvl_add lvl="10" hp="246.35" mp="108.4" cp="221.715"/>
            <lvl_add lvl="11" hp="263.35" mp="116.4" cp="237.015"/>
            <lvl_add lvl="12" hp="280.52" mp="124.48" cp="252.468"/>
            <lvl_add lvl="13" hp="297.86" mp="132.64" cp="268.074"/>
            <lvl_add lvl="14" hp="315.37" mp="140.88" cp="283.833"/>
            <lvl_add lvl="15" hp="333.05" mp="149.2" cp="299.745"/>
            <lvl_add lvl="16" hp="350.9" mp="157.6" cp="315.81"/>
            <lvl_add lvl="17" hp="368.92" mp="166.08" cp="332.028"/>
            <lvl_add lvl="18" hp="387.11" mp="174.64" cp="348.399"/>
            <lvl_add lvl="19" hp="405.47" mp="183.28" cp="364.923"/>
            <lvl_add lvl="20" hp="424.0" mp="192.0" cp="381.6"/>
            <lvl_add lvl="21" hp="458.1" mp="205.2" cp="412.29"/>
            <lvl_add lvl="22" hp="492.51" mp="218.52" cp="443.259"/>
            <lvl_add lvl="23" hp="527.23" mp="231.96" cp="474.507"/>
            <lvl_add lvl="24" hp="562.26" mp="245.52" cp="506.034"/>
            <lvl_add lvl="25" hp="597.6" mp="259.2" cp="537.84"/>
            <lvl_add lvl="26" hp="633.25" mp="273.0" cp="569.925"/>
            <lvl_add lvl="27" hp="669.21" mp="286.92" cp="602.289"/>
            <lvl_add lvl="28" hp="705.48" mp="300.96" cp="634.932"/>
            <lvl_add lvl="29" hp="742.06" mp="315.12" cp="667.854"/>
            <lvl_add lvl="30" hp="778.95" mp="329.4" cp="701.055"/>
            <lvl_add lvl="31" hp="816.15" mp="343.8" cp="734.535"/>
            <lvl_add lvl="32" hp="853.66" mp="358.32" cp="768.294"/>
            <lvl_add lvl="33" hp="891.48" mp="372.96" cp="802.332"/>
            <lvl_add lvl="34" hp="929.61" mp="387.72" cp="836.649"/>
            <lvl_add lvl="35" hp="968.05" mp="402.6" cp="871.245"/>
            <lvl_add lvl="36" hp="1006.8" mp="417.6" cp="906.12"/>
            <lvl_add lvl="37" hp="1045.86" mp="432.72" cp="941.274"/>
            <lvl_add lvl="38" hp="1085.23" mp="447.96" cp="976.707"/>
            <lvl_add lvl="39" hp="1124.91" mp="463.32" cp="1012.419"/>
            <lvl_add lvl="40" hp="1164.9" mp="478.8" cp="1048.41"/>
            <lvl_add lvl="41" hp="1214.3" mp="504.8" cp="1092.87"/>
            <lvl_add lvl="42" hp="1264.08" mp="531.0" cp="1137.672"/>
            <lvl_add lvl="43" hp="1314.24" mp="557.4" cp="1182.816"/>
            <lvl_add lvl="44" hp="1364.78" mp="584.0" cp="1228.302"/>
            <lvl_add lvl="45" hp="1415.7" mp="610.8" cp="1274.13"/>
            <lvl_add lvl="46" hp="1467.0" mp="637.8" cp="1320.3"/>
            <lvl_add lvl="47" hp="1518.68" mp="665.0" cp="1366.812"/>
            <lvl_add lvl="48" hp="1570.74" mp="692.4" cp="1413.666"/>
            <lvl_add lvl="49" hp="1623.18" mp="720.0" cp="1460.862"/>
            <lvl_add lvl="50" hp="1676.0" mp="747.8" cp="1508.4"/>
            <lvl_add lvl="51" hp="1729.2" mp="775.8" cp="1556.28"/>
            <lvl_add lvl="52" hp="1782.78" mp="804.0" cp="1604.502"/>
            <lvl_add lvl="53" hp="1836.74" mp="832.4" cp="1653.066"/>
            <lvl_add lvl="54" hp="1891.08" mp="861.0" cp="1701.972"/>
            <lvl_add lvl="55" hp="1945.8" mp="889.8" cp="1751.22"/>
            <lvl_add lvl="56" hp="2000.9" mp="918.8" cp="1800.81"/>
            <lvl_add lvl="57" hp="2056.38" mp="948.0" cp="1850.742"/>
            <lvl_add lvl="58" hp="2112.24" mp="977.4" cp="1901.016"/>
            <lvl_add lvl="59" hp="2168.48" mp="1007.0" cp="1951.632"/>
            <lvl_add lvl="60" hp="2225.1" mp="1036.8" cp="2002.59"/>
            <lvl_add lvl="61" hp="2282.1" mp="1066.8" cp="2053.89"/>
            <lvl_add lvl="62" hp="2339.48" mp="1097.0" cp="2105.532"/>
            <lvl_add lvl="63" hp="2397.24" mp="1127.4" cp="2157.516"/>
            <lvl_add lvl="64" hp="2455.38" mp="1158.0" cp="2209.842"/>
            <lvl_add lvl="65" hp="2513.9" mp="1188.8" cp="2262.51"/>
            <lvl_add lvl="66" hp="2572.8" mp="1219.8" cp="2315.52"/>
            <lvl_add lvl="67" hp="2632.08" mp="1251.0" cp="2368.872"/>
            <lvl_add lvl="68" hp="2691.74" mp="1282.4" cp="2422.566"/>
            <lvl_add lvl="69" hp="2751.78" mp="1314.0" cp="2476.602"/>
            <lvl_add lvl="70" hp="2812.2" mp="1345.8" cp="2530.98"/>
            <lvl_add lvl="71" hp="2873.0" mp="1377.8" cp="2585.7"/>
            <lvl_add lvl="72" hp="2934.18" mp="1410.0" cp="2640.762"/>
            <lvl_add lvl="73" hp="2995.74" mp="1442.4" cp="2696.166"/>
            <lvl_add lvl="74" hp="3057.68" mp="1475.0" cp="2751.912"/>
            <lvl_add lvl="75" hp="3120.0" mp="1507.8" cp="2808.0"/>
            <lvl_add lvl="76" hp="3182.7" mp="1540.8" cp="2864.43"/>
            <lvl_add lvl="77" hp="3245.78" mp="1574.0" cp="2921.202"/>
            <lvl_add lvl="78" hp="3309.24" mp="1607.4" cp="2978.316"/>
            <lvl_add lvl="79" hp="3373.08" mp="1641.0" cp="3035.772"/>
            <lvl_add lvl="80" hp="3437.3" mp="1674.8" cp="3093.57"/>
            <lvl_add lvl="81" hp="3501.9" mp="1708.8" cp="3151.71"/>
            <lvl_add lvl="82" hp="3566.88" mp="1743.0" cp="3210.192"/>
            <lvl_add lvl="83" hp="3632.24" mp="1777.4" cp="3269.016"/>
            <lvl_add lvl="84" hp="3697.98" mp="1812.0" cp="3328.182"/>
            <lvl_add lvl="85" hp="6718.53" mp="3693.6" cp="9091.79"/>
            <lvl_add lvl="86" hp="6784.4" mp="3763.6" cp="9180.92"/>
            <lvl_add lvl="87" hp="6850.91" mp="3834.0" cp="9270.93"/>
            <lvl_add lvl="88" hp="6918.08" mp="3904.8" cp="9361.82"/>
            <lvl_add lvl="89" hp="6985.9" mp="3976.0" cp="9453.6"/>
            <lvl_add lvl="90" hp="7054.39" mp="4047.6" cp="9546.29"/>
            <lvl_add lvl="91" hp="7123.55" mp="4119.6" cp="9639.88"/>
            <lvl_add lvl="92" hp="7193.39" mp="4192.0" cp="9734.39"/>
            <lvl_add lvl="93" hp="7263.92" mp="4264.8" cp="9829.82"/>
            <lvl_add lvl="94" hp="7335.13" mp="4338.0" cp="9926.19"/>
            <lvl_add lvl="95" hp="7407.04" mp="4411.6" cp="10023.51"/>
            <lvl_add lvl="96" hp="7479.66" mp="4485.6" cp="10121.78"/>
            <lvl_add lvl="97" hp="7552.99" mp="4560.0" cp="10221.01"/>
            <lvl_add lvl="98" hp="7627.04" mp="4634.8" cp="10321.22"/>
            <lvl_add lvl="99" hp="7701.81" mp="4710.0" cp="10422.4"/>
        </lvl_up_data>
    </class_data>
</list>
